{
  "$schema": "http://json-schema.org/draft-07/schema#",
  "$id": "https://mother-game.local/schemas/event.schema.json",
  "title": "event",
  "type": "object",
  "required": ["schema_version", "event_id", "chapter", "title_kr", "event_class", "emotion_tags", "trigger", "priority", "scenes", "choices", "once", "cooldown_days"],
  "additionalProperties": false,
  "properties": {
    "schema_version": { "type": "string", "pattern": "^[0-9]+\\.[0-9]+$" },
    "event_id": { "type": "string", "pattern": "^ch[1-5]_ev_([0-9]{3}|[a-z][a-z0-9_]*)$" },
    "chapter": { "type": "integer", "minimum": 1, "maximum": 5 },
    "title_kr": { "type": "string", "minLength": 1, "maxLength": 40 },
    "event_class": { "enum": ["major", "minor", "system"] },
    "emotion_tags": {
      "type": "array",
      "minItems": 1,
      "uniqueItems": true,
      "items": {
        "enum": ["overwhelmed", "wonder", "isolation", "joy", "burnout", "reward", "pride", "worry", "comparison", "guilt", "reconciliation", "letting_go", "fulfillment", "loss"]
      }
    },
    "trigger": {
      "type": "object",
      "required": ["type", "conditions"],
      "additionalProperties": false,
      "properties": {
        "type": { "enum": ["scheduled", "conditional", "random"] },
        "conditions": { "type": "array", "items": { "$ref": "#/definitions/condition" } },
        "weight": { "type": "integer", "minimum": 1, "maximum": 100 }
      }
    },
    "priority": { "type": "integer", "minimum": 0, "maximum": 100 },
    "scenes": { "type": "array", "items": { "type": "string", "pattern": "^ch[1-5]_sc_[0-9]{3}$" } },
    "choices": { "type": "array", "minItems": 1, "maxItems": 4, "items": { "$ref": "#/definitions/choice" } },
    "once": { "type": "boolean" },
    "cooldown_days": { "type": "integer", "minimum": 0 }
  },
  "definitions": {
    "condition": {
      "oneOf": [
        {
          "type": "object",
          "required": ["stat", "op", "value"],
          "additionalProperties": false,
          "properties": {
            "stat": { "enum": ["attachment", "child_condition", "stamina", "mind", "money", "husband_support", "confidence", "empathy", "independence", "expressiveness", "day_counter", "chapter"] },
            "op": { "enum": ["lt", "lte", "gt", "gte", "eq", "neq"] },
            "value": { "type": "integer" }
          }
        },
        {
          "type": "object",
          "required": ["memory", "exists"],
          "additionalProperties": false,
          "properties": {
            "memory": { "type": "string", "pattern": "^mem_ch[1-5]_[a-z0-9_]+$" },
            "exists": { "type": "boolean" }
          }
        },
        {
          "type": "object",
          "required": ["rel", "op", "value"],
          "additionalProperties": false,
          "properties": {
            "rel": { "type": "string", "pattern": "^npc_[a-z_]+$" },
            "op": { "enum": ["lt", "lte", "gt", "gte", "eq", "neq"] },
            "value": { "type": "integer", "minimum": 0, "maximum": 100 }
          }
        },
        {
          "type": "object",
          "required": ["ctx", "eq"],
          "additionalProperties": false,
          "properties": {
            "ctx": { "enum": ["time_block", "holiday", "preset", "seed"] },
            "eq": { "type": "string" }
          }
        }
      ]
    },
    "effects": {
      "type": "object",
      "additionalProperties": false,
      "properties": {
        "attachment": { "type": "integer", "minimum": -20, "maximum": 20 },
        "child_condition": { "type": "integer", "minimum": -20, "maximum": 20 },
        "stamina": { "type": "integer", "minimum": -20, "maximum": 20 },
        "mind": { "type": "integer", "minimum": -20, "maximum": 20 },
        "money": { "type": "integer" },
        "confidence": { "type": "integer", "minimum": -3, "maximum": 3 },
        "empathy": { "type": "integer", "minimum": -3, "maximum": 3 },
        "independence": { "type": "integer", "minimum": -3, "maximum": 3 },
        "expressiveness": { "type": "integer", "minimum": -3, "maximum": 3 },
        "rel": { "type": "object", "additionalProperties": false, "patternProperties": { "^npc_[a-z_]+$": { "type": "integer", "minimum": -10, "maximum": 10 } } }
      }
    },
    "choice": {
      "type": "object",
      "required": ["choice_id", "text_kr", "effects"],
      "additionalProperties": false,
      "properties": {
        "choice_id": { "type": "string", "pattern": "^ch[1-5]_ev_([0-9]{3}|[a-z][a-z0-9_]*)_c[0-9]+$" },
        "text_kr": { "type": "string", "minLength": 1, "maxLength": 60 },
        "requires": {
          "type": "object",
          "additionalProperties": false,
          "properties": {
            "mind_min": { "type": "integer", "minimum": 0, "maximum": 100 },
            "stamina_min": { "type": "integer", "minimum": 0, "maximum": 100 },
            "money_min": { "type": "integer", "minimum": 0 }
          }
        },
        "effects": { "$ref": "#/definitions/effects" },
        "memory_tag": { "type": "string", "pattern": "^mem_ch[1-5]_[a-z0-9_]+$" }
      }
    }
  }
}
