{
  "schema_version": "1.1",
  "event_id": "ch5_ev_013",
  "chapter": 5,
  "title_kr": "입학식",
  "event_class": "major",
  "emotion_tags": [
    "letting_go",
    "fulfillment",
    "loss"
  ],
  "trigger": {
    "type": "scheduled",
    "conditions": [
      {
        "stat": "day_counter",
        "op": "gte",
        "value": 2501
      },
      {
        "stat": "day_counter",
        "op": "lte",
        "value": 2501
      },
      {
        "ctx": "time_block",
        "eq": "morning"
      }
    ]
  },
  "priority": 100,
  "scenes": [
    "ch5_sc_020",
    "ch5_sc_021",
    "ch5_sc_022"
  ],
  "choices": [
    {
      "choice_id": "ch5_ev_013_c1",
      "text_kr": "교실 앞까지 같이 들어간다",
      "effects": {
        "attachment": 3,
        "independence": -1,
        "stamina": -2
      },
      "memory_tag": "mem_ch5_entrance_walk_in"
    },
    {
      "choice_id": "ch5_ev_013_c2",
      "text_kr": "교문 앞에서 멈춰 서서, 손을 흔들어 보낸다",
      "effects": {
        "independence": 2,
        "attachment": 1,
        "mind": -3
      },
      "memory_tag": "mem_ch5_entrance_wave"
    }
  ],
  "once": true,
  "cooldown_days": 0
}
