{
  "schema_version": "1.1",
  "event_id": "ch5_ev_005",
  "chapter": 5,
  "title_kr": "이름 쓰기 연습",
  "event_class": "minor",
  "emotion_tags": [
    "fulfillment"
  ],
  "trigger": {
    "type": "random",
    "conditions": [],
    "weight": 20
  },
  "priority": 45,
  "scenes": [
    "ch5_sc_006"
  ],
  "choices": [
    {
      "choice_id": "ch5_ev_005_c1",
      "text_kr": "삐뚤빼뚤해도 끝까지 혼자 쓰게 둔다",
      "effects": {
        "independence": 2,
        "confidence": 1,
        "mind": -1
      },
      "memory_tag": "mem_ch5_name_writing"
    },
    {
      "choice_id": "ch5_ev_005_c2",
      "text_kr": "손을 겹쳐 잡고 같이 쓴다",
      "effects": {
        "attachment": 3,
        "independence": -1,
        "stamina": -1
      },
      "memory_tag": "mem_ch5_name_writing_hand"
    },
    {
      "choice_id": "ch5_ev_005_c3",
      "text_kr": "제일 잘 쓴 글자를 벽에 붙여 준다",
      "effects": {
        "confidence": 1,
        "expressiveness": 1,
        "stamina": -1
      },
      "memory_tag": "mem_ch5_name_writing_wall"
    }
  ],
  "once": true,
  "cooldown_days": 0
}
